{
  "run_id": "synthetic-demo-2026-09-23",
  "as_of_date": "2026-09-23",
  "warehouse_id": "demo-almaty",
  "data_source": "synthetic",
  "status": "draft",
  "recommendations": [
    {
      "sku": "CABLE-01",
      "name": "Кабель силовой, учебный SKU",
      "category": "Кабели",
      "supplier_id": "supplier-a",
      "supplier_name": "Синтетический поставщик A",
      "recommended_quantity": 25,
      "selected_quantity": 25,
      "urgency": "high",
      "factors": {
        "regular_daily_demand": 1,
        "seasonality_multiplier": 1.2,
        "trend_multiplier": 1,
        "external_growth_multiplier": 1,
        "estimated_lost_demand": 0,
        "coverage_days": 28,
        "forecast_during_coverage": 33.6,
        "safety_stock": 8.4,
        "current_stock": 12,
        "goods_in_transit": 5,
        "stock_as_of_date": "2026-09-22",
        "stock_source": "Синтетическая фикстура"
      },
      "reason": "Учебный пример: сезонный спрос 33,6 шт. и страховой запас 8,4 шт.; с учётом 12 шт. на складе и 5 шт. в пути рекомендовано 25 шт. Крупный документ помечен отдельно.",
      "flags": ["one_off_sale", "seasonality"]
    },
    {
      "sku": "LAMP-02",
      "name": "Светильник промышленный, учебный SKU",
      "category": "Освещение",
      "supplier_id": "supplier-b",
      "supplier_name": "Синтетический поставщик B",
      "recommended_quantity": 36,
      "selected_quantity": 36,
      "urgency": "critical",
      "factors": {
        "regular_daily_demand": 0.8,
        "seasonality_multiplier": 1,
        "trend_multiplier": 1,
        "external_growth_multiplier": 1.05,
        "estimated_lost_demand": 4,
        "coverage_days": 35,
        "forecast_during_coverage": 29.4,
        "safety_stock": 5.88,
        "current_stock": 0,
        "goods_in_transit": 0,
        "stock_as_of_date": "2026-09-22",
        "stock_source": "Синтетическая фикстура"
      },
      "reason": "Учебный пример: товара нет на складе и в пути. Прогноз на горизонт — 29,4 шт., страховой запас — 5,88 шт.; заказ округлён до 36 шт. Дефицит подтверждён в синтетическом сценарии.",
      "flags": ["stockout_adjustment", "growth"]
    },
    {
      "sku": "SWITCH-03",
      "name": "Выключатель модульный, учебный SKU",
      "category": "Коммутация",
      "supplier_id": "supplier-a",
      "supplier_name": "Синтетический поставщик A",
      "recommended_quantity": 5,
      "selected_quantity": 5,
      "urgency": "medium",
      "factors": {
        "regular_daily_demand": 0.3,
        "seasonality_multiplier": 1,
        "trend_multiplier": 1,
        "external_growth_multiplier": 1,
        "estimated_lost_demand": 0,
        "coverage_days": 28,
        "forecast_during_coverage": 8.4,
        "safety_stock": 2.1,
        "current_stock": 4,
        "goods_in_transit": 2
      },
      "reason": "Учебный пример: на короткой истории прогноз 8,4 шт. на горизонт; после учёта запаса, остатка и товара в пути рекомендовано 5 шт. Дата остатка не задана.",
      "flags": ["short_history", "missing_data"]
    },
    {
      "sku": "FUSE-04",
      "name": "Предохранитель, учебный SKU",
      "category": "Защита",
      "supplier_id": "supplier-b",
      "supplier_name": "Синтетический поставщик B",
      "recommended_quantity": 0,
      "selected_quantity": 0,
      "urgency": "low",
      "factors": {
        "regular_daily_demand": 0.5,
        "seasonality_multiplier": 1,
        "trend_multiplier": 1,
        "external_growth_multiplier": 1,
        "estimated_lost_demand": 0,
        "coverage_days": 28,
        "forecast_during_coverage": 14,
        "safety_stock": 3.5,
        "current_stock": 25,
        "goods_in_transit": 0,
        "stock_as_of_date": "2026-09-22",
        "stock_source": "Синтетическая фикстура"
      },
      "reason": "Учебный пример: 25 шт. на складе покрывают прогноз 14 шт. и страховой запас 3,5 шт.; заказ не нужен.",
      "flags": []
    }
  ]
}
